{
  "user_id": "usr_alpha_99",
  "primary_persona": "The Architect",
  "current_core_lesson": "Moving from rigid structures to adaptive flow.",
  "known_patterns": ["Over-intellectualizing emotions", "Perfectionism as a shield"],
  "integrated_wisdom": ["Recognizing physical tension before reacting"],
  "current_blind_spots": ["Assuming others operate with the same mental frameworks"],
  "stage": "DRAFT"
}
